{
  "$schema": "https://json-schema.org/draft/2020-12/schema",
  "$id": "https://smartperfetto.dev/schemas/trace-case-v1.json",
  "title": "SmartPerfetto Trace Case",
  "type": "object",
  "additionalProperties": false,
  "required": [
    "schema_version",
    "id",
    "kind",
    "title",
    "description",
    "scene",
    "tags",
    "trace",
    "android",
    "source",
    "analysis",
    "coverage"
  ],
  "properties": {
    "schema_version": {"const": 1},
    "id": {"type": "string", "pattern": "^[a-z0-9]+(?:-[a-z0-9]+)*$"},
    "kind": {"enum": ["real", "constructed"]},
    "title": {"type": "string", "minLength": 1},
    "description": {"type": "string", "minLength": 1},
    "scene": {"type": "string", "minLength": 1},
    "tags": {"type": "array", "items": {"type": "string"}, "uniqueItems": true},
    "aliases": {"type": "array", "items": {"type": "string"}, "uniqueItems": true},
    "trace": {
      "type": "object",
      "additionalProperties": false,
      "required": ["file", "format", "sha256", "materialization"],
      "properties": {
        "file": {"type": "string", "minLength": 1},
        "format": {"const": "perfetto-protobuf"},
        "sha256": {"type": "string", "pattern": "^[a-f0-9]{64}$"},
        "materialization": {"enum": ["committed", "base-plus-overlay"]}
      }
    },
    "android": {
      "type": "object",
      "required": ["release", "api_level", "device", "build_fingerprint", "compatibility"],
      "properties": {
        "release": {"type": ["string", "null"]},
        "api_level": {"type": ["integer", "null"], "minimum": 1},
        "device": {"type": ["string", "null"]},
        "build_fingerprint": {"type": ["string", "null"]},
        "compatibility": {
          "type": "object",
          "required": ["min_api", "max_api"],
          "properties": {
            "min_api": {"type": ["integer", "null"], "minimum": 1},
            "max_api": {"type": ["integer", "null"], "minimum": 1}
          }
        }
      }
    },
    "source": {
      "type": "object",
      "required": ["origin", "captured_at", "imported_at", "license", "consent", "privacy_review", "sanitization_review", "publication"],
      "properties": {
        "origin": {"type": "string", "minLength": 1},
        "captured_at": {"type": ["string", "null"]},
        "imported_at": {"type": "string", "minLength": 1},
        "license": {"type": ["string", "null"]},
        "consent": {"type": ["string", "null"]},
        "privacy_review": {"enum": ["approved", "not-applicable", "pending", null]},
        "sanitization_review": {"enum": ["approved", "not-applicable", "pending", null]},
        "publication": {"enum": ["public", "private", "legacy-tracked"]}
      }
    },
    "analysis": {
      "type": "object",
      "required": ["results", "logs"],
      "properties": {
        "results": {"type": "array", "items": {"type": "string"}, "uniqueItems": true},
        "logs": {"type": "array", "items": {"type": "string"}, "uniqueItems": true}
      }
    },
    "construction": {
      "type": "object",
      "required": ["base_case_id", "scenario_file", "generator_version", "seed", "output"],
      "properties": {
        "base_case_id": {"type": "string"},
        "scenario_file": {"type": "string"},
        "generator_version": {"type": "integer", "minimum": 1},
        "seed": {"type": "string", "minLength": 1},
        "output": {"type": "string", "minLength": 1}
      }
    },
    "coverage": {
      "type": "object",
      "required": ["skills", "strategies", "expectations"],
      "properties": {
        "skills": {"type": "array", "items": {"type": "string"}, "uniqueItems": true},
        "strategies": {"type": "array", "items": {"type": "string"}, "uniqueItems": true},
        "expectations": {
          "type": "array",
          "items": {
            "type": "object",
            "required": ["id", "type", "target"],
            "properties": {
              "id": {"type": "string", "minLength": 1},
              "type": {"enum": ["skill", "strategy", "sql"]},
              "target": {"type": "string", "minLength": 1}
            }
          }
        }
      }
    }
  },
  "allOf": [
    {
      "if": {"properties": {"kind": {"const": "constructed"}}},
      "then": {"required": ["construction"]}
    }
  ]
}
