{
  "schema_version": 1,
  "id": "media-network-camera",
  "kind": "constructed",
  "title": "Media, network, and camera pipeline",
  "description": "Deterministic media, network, and camera pipeline signals over the android-scroll-customer real base trace.",
  "scene": "media",
  "tags": [
    "android",
    "constructed",
    "media"
  ],
  "aliases": [],
  "trace": {
    "file": "trace.overlay.pftrace",
    "format": "perfetto-protobuf",
    "sha256": "4abf868de9627fd097ba4a473eca1f137a0d17351b12e43817dc0c0e16448ce4",
    "materialization": "base-plus-overlay"
  },
  "android": {
    "release": "16",
    "api_level": 36,
    "device": "OPPO PKH110 base",
    "build_fingerprint": null,
    "compatibility": {
      "min_api": 35,
      "max_api": 36
    }
  },
  "source": {
    "origin": "SmartPerfetto deterministic trace generator",
    "captured_at": null,
    "imported_at": "2026-07-13T00:00:00.000Z",
    "license": "AGPL-3.0-or-later",
    "consent": "generated",
    "privacy_review": "not-applicable",
    "sanitization_review": "not-applicable",
    "publication": "public"
  },
  "analysis": {
    "results": [
      "analysis/expected.json"
    ],
    "logs": []
  },
  "construction": {
    "base_case_id": "android-scroll-customer",
    "scenario_file": "scenario.json",
    "generator_version": 1,
    "seed": "media-network-camera-v1",
    "output": "Trace/.generated/constructed/media-network-camera/trace.pftrace"
  },
  "coverage": {
    "skills": [
      "camera_trace_evidence",
      "media_codec_activity",
      "modem_network_correlation_summary",
      "network_analysis",
      "pipeline_camera_pipeline",
      "webview_v8_analysis"
    ],
    "strategies": [
      "media",
      "network"
    ],
    "expectations": [
      {
        "id": "execute-camera_trace_evidence",
        "type": "skill",
        "target": "camera_trace_evidence",
        "mode": "semantic",
        "source_file": "backend/skills/composite/camera_trace_evidence.skill.yaml",
        "parameters": {
          "max_rows": 20
        },
        "required_steps": [
          "evidence_coverage",
          "camera_process_candidates",
          "camera_slice_candidates"
        ],
        "semantic_step": "camera_slice_candidates",
        "min_rows": 2,
        "assertions": [
          {
            "column": "slice_name",
            "operator": "contains",
            "value": "Camera3-Device"
          }
        ],
        "required_marker": "SmartPerfetto::CASE::media-network-camera"
      },
      {
        "id": "execute-media_codec_activity",
        "type": "skill",
        "target": "media_codec_activity",
        "mode": "execution",
        "source_file": "backend/skills/atomic/media_codec_activity.skill.yaml",
        "parameters": {},
        "required_steps": [
          "codec_activity_summary"
        ],
        "semantic_step": "codec_activity_summary",
        "required_marker": "SmartPerfetto::CASE::media-network-camera"
      },
      {
        "id": "execute-modem_network_correlation_summary",
        "type": "skill",
        "target": "modem_network_correlation_summary",
        "mode": "execution",
        "source_file": "backend/skills/atomic/modem_network_correlation_summary.skill.yaml",
        "parameters": {
          "top_n": 20
        },
        "required_steps": [
          "modem_network_correlation"
        ],
        "semantic_step": "modem_network_correlation",
        "required_marker": "SmartPerfetto::CASE::media-network-camera"
      },
      {
        "id": "execute-network_analysis",
        "type": "skill",
        "target": "network_analysis",
        "mode": "execution",
        "source_file": "backend/skills/composite/network_analysis.skill.yaml",
        "parameters": {
          "heavy_traffic_critical_mb": 100,
          "heavy_traffic_warning_mb": 10,
          "frequent_active_periods": 20
        },
        "required_steps": [
          "check_network_data",
          "check_network_slices",
          "evidence_scope",
          "network_overview",
          "traffic_by_interface",
          "app_traffic_ranking",
          "transport_distribution",
          "port_analysis",
          "traffic_timeline",
          "large_transfers",
          "network_power_cost",
          "network_slice_overview"
        ],
        "semantic_step": "network_slice_overview",
        "required_marker": "SmartPerfetto::CASE::media-network-camera"
      },
      {
        "id": "definition-pipeline_camera_pipeline",
        "type": "skill",
        "target": "pipeline_camera_pipeline",
        "mode": "definition",
        "source_file": "backend/skills/pipelines/camera_pipeline.skill.yaml",
        "required_marker": "SmartPerfetto::CASE::media-network-camera"
      },
      {
        "id": "execute-webview_v8_analysis",
        "type": "skill",
        "target": "webview_v8_analysis",
        "mode": "execution",
        "source_file": "backend/skills/atomic/webview_v8_analysis.skill.yaml",
        "parameters": {},
        "required_steps": [
          "v8_gc_events"
        ],
        "semantic_step": "v8_gc_events",
        "required_marker": "SmartPerfetto::CASE::media-network-camera"
      },
      {
        "id": "strategy-media",
        "type": "strategy",
        "target": "media",
        "query": "视频",
        "expected_strategy": "media",
        "source_file": "backend/strategies/media.strategy.md",
        "required_marker": "SmartPerfetto::CASE::media-network-camera"
      },
      {
        "id": "strategy-network",
        "type": "strategy",
        "target": "network",
        "query": "网络",
        "expected_strategy": "network",
        "source_file": "backend/strategies/network.strategy.md",
        "required_marker": "SmartPerfetto::CASE::media-network-camera"
      }
    ]
  }
}
